{
  "schemaVersion": 1,
  "verifiedAt": "2026-10-16",
  "sources": [
    "https://anime-cinderellagray.com/character/",
    "https://umamusu.wiki/Category:Cinderella_Gray_Characters"
  ],
  "characters": [
    {
      "characterId": "oguri-cap",
      "kind": "main",
      "nameJa": "オグリキャップ",
      "sources": [
        "https://umamusu.wiki/Oguri_Cap",
        "https://anime-cinderellagray.com/story/?ep=3",
        "https://anime-cinderellagray.com/character/?type=0&i=0",
        "https://anime-cinderellagray.com/story/?ep=2",
        "https://anime-cinderellagray.com/story/?ep=6",
        "https://anime-cinderellagray.com/story/?ep=8",
        "https://wikiwiki.jp/vip_umamusu/元馬情報",
        "https://arthanblog.com/ucg-yj-210/",
        "https://arthanblog.com/ucg-c22/"
      ],
      "clueIds": [
        "oguri-cap-cinderella-original",
        "oguri-cap-cinderella-mothers-knee-care",
        "oguri-cap-cinderella-gold-junior-transfer",
        "oguri-cap-cinderella-no-classic-registration",
        "oguri-cap-cinderella-mile-jc-back-to-back",
        "oguri-cap-cinderella-last-run-revival",
        "oguri-cap-cinderella-kitahara-midnight-question"
      ]
    },
    {
      "characterId": "belno-light",
      "kind": "original",
      "nameJa": "ベルノライト",
      "sources": [
        "https://umamusu.wiki/Belno_Light",
        "https://anime-cinderellagray.com/story/?ep=3",
        "https://anime-cinderellagray.com/character/?type=0&i=1",
        "https://anime-cinderellagray.com/story/?ep=6",
        "https://anime-cinderellagray.com/story/?ep=16",
        "https://arthanblog.com/ucg-yj199r/",
        "https://heysay.hatenadiary.jp/entry/2025/12/25/000154"
      ],
      "clueIds": [
        "belno-light-cinderella-original",
        "belno-light-cinderella-support-transfer-exam",
        "belno-light-cinderella-foreign-team-investigation",
        "belno-light-cinderella-supporters-declaration",
        "belno-light-cinderella-postscript-assistant"
      ]
    },
    {
      "characterId": "fujimasa-march",
      "kind": "original",
      "nameJa": "フジマサマーチ",
      "sources": [
        "https://umamusu.wiki/Fujimasa_March",
        "https://wikiwiki.jp/vip_umamusu/元馬情報",
        "https://anime-cinderellagray.com/story/?ep=2",
        "https://anime-cinderellagray.com/character/?type=0&i=4",
        "https://anime-cinderellagray.com/story/?ep=4",
        "https://anime-cinderellagray.com/story/?ep=14"
      ],
      "clueIds": [
        "fujimasa-march-cinderella-original",
        "fujimasa-march-cinderella-mount-kinka-promise",
        "fujimasa-march-cinderella-telephone-japans-best",
        "fujimasa-march-cinderella-gifu-crown-comeback",
        "fujimasa-march-cinderella-walk-dancer-roommate"
      ]
    },
    {
      "characterId": "norn-ace",
      "kind": "original",
      "nameJa": "ノルンエース",
      "sources": [
        "https://umamusu.wiki/Norn_Ace",
        "https://anime-cinderellagray.com/story/?ep=4",
        "https://anime-cinderellagray.com/character/?type=0&i=5",
        "https://anime-cinderellagray.com/story/?ep=1",
        "https://anime-cinderellagray.com/story/?ep=6",
        "https://anime-cinderellagray.com/story/?ep=3"
      ],
      "clueIds": [
        "norn-ace-cinderella-original",
        "norn-ace-cinderella-storage-room-eviction",
        "norn-ace-cinderella-oguri-plush",
        "norn-ace-cinderella-race-sand-apology"
      ]
    },
    {
      "characterId": "rudy-lemono",
      "kind": "original",
      "nameJa": "ルディレモーノ",
      "sources": [
        "https://umamusu.wiki/Rudy_Lemono",
        "https://anime-cinderellagray.com/character/?type=0&i=6",
        "https://umamusu.wiki/Norn_Ace"
      ],
      "clueIds": [
        "rudy-lemono-cinderella-original",
        "rudy-lemono-cinderella-norn-handkerchief"
      ]
    },
    {
      "characterId": "mini-the-lady",
      "kind": "original",
      "nameJa": "ミニーザレディ",
      "sources": [
        "https://umamusu.wiki/Mini_the_Lady",
        "https://umamusu.wiki/Norn_Ace",
        "https://anime-cinderellagray.com/story/?ep=3",
        "https://anime-cinderellagray.com/character/?type=0&i=7"
      ],
      "clueIds": [
        "mini-the-lady-cinderella-original",
        "mini-the-lady-cinderella-second-in-class"
      ]
    },
    {
      "characterId": "tamamo-cross",
      "kind": "main",
      "nameJa": "タマモクロス",
      "sources": [
        "https://umamusu.wiki/Tamamo_Cross",
        "https://anime-cinderellagray.com/story/?ep=13",
        "https://anime-cinderellagray.com/character/?type=0&i=8",
        "https://anime-cinderellagray.com/story/?ep=4",
        "https://wikiwiki.jp/vip_umamusu/元馬情報",
        "https://anime-cinderellagray.com/story/?ep=10",
        "https://anime-cinderellagray.com/story/?ep=12",
        "https://anime-cinderellagray.com/story/?ep=20"
      ],
      "clueIds": [
        "tamamo-cross-cinderella-original",
        "tamamo-cross-cinderella-wrong-train-kasamatsu",
        "tamamo-cross-cinderella-akitsu-takarazuka",
        "tamamo-cross-cinderella-surprise-forward-tactic",
        "tamamo-cross-cinderella-retirement-announcement"
      ]
    },
    {
      "characterId": "yaeno-muteki",
      "kind": "main",
      "nameJa": "ヤエノムテキ",
      "sources": [
        "https://umamusu.wiki/Yaeno_Muteki",
        "https://wikiwiki.jp/vip_umamusu/元馬情報",
        "https://anime-cinderellagray.com/story/?ep=8",
        "https://anime-cinderellagray.com/character/?type=0&i=9",
        "https://anime-cinderellagray.com/story/?ep=15",
        "https://twicomi.com/manga/yj_umaCG/1930278426201731535"
      ],
      "clueIds": [
        "yaeno-muteki-cinderella-original",
        "yaeno-muteki-cinderella-challenge-letter",
        "yaeno-muteki-cinderella-twelve-length-dirt-win",
        "yaeno-muteki-cinderella-kikka-creek-opponent",
        "yaeno-muteki-cinderella-final-autumn-tenno-win"
      ]
    },
    {
      "characterId": "sakura-chiyono-o",
      "kind": "main",
      "nameJa": "サクラチヨノオー",
      "sources": [
        "https://umamusu.wiki/Sakura_Chiyono_O",
        "https://anime-cinderellagray.com/story/?ep=9",
        "https://anime-cinderellagray.com/character/?type=0&i=10",
        "https://wikiwiki.jp/vip_umamusu/元馬情報",
        "https://anime-cinderellagray.com/story/?ep=8"
      ],
      "clueIds": [
        "sakura-chiyono-o-cinderella-original",
        "sakura-chiyono-o-cinderella-idol-ineligibility",
        "sakura-chiyono-o-cinderella-satsuki-third"
      ]
    },
    {
      "characterId": "mejiro-ardan",
      "kind": "main",
      "nameJa": "メジロアルダン",
      "sources": [
        "https://umamusu.wiki/Mejiro_Ardan",
        "https://anime-cinderellagray.com/story/?ep=9",
        "https://anime-cinderellagray.com/character/?type=0&i=11",
        "https://wikiwiki.jp/vip_umamusu/元馬情報",
        "https://kouhey.blog.jp/archives/40436903.html"
      ],
      "clueIds": [
        "mejiro-ardan-cinderella-original",
        "mejiro-ardan-cinderella-injury-comeback",
        "mejiro-ardan-cinderella-ramonu-shadow",
        "mejiro-ardan-cinderella-last-autumn-runner-up"
      ]
    },
    {
      "characterId": "super-creek",
      "kind": "main",
      "nameJa": "スーパークリーク",
      "sources": [
        "https://umamusu.wiki/Super_Creek",
        "https://anime-cinderellagray.com/story/?ep=15",
        "https://anime-cinderellagray.com/character/?type=0&i=12",
        "https://anime-cinderellagray.com/story/?ep=22",
        "https://wikiwiki.jp/vip_umamusu/元馬情報"
      ],
      "clueIds": [
        "super-creek-cinderella-original",
        "super-creek-cinderella-arima-disqualification",
        "super-creek-cinderella-kyoto-return",
        "super-creek-cinderella-second-autumn-tenno-win",
        "super-creek-cinderella-last-spring-tenno"
      ]
    },
    {
      "characterId": "dicta-striker",
      "kind": "original",
      "nameJa": "ディクタストライカ",
      "sources": [
        "https://umamusu.wiki/Dicta_Striker",
        "https://w.atwiki.jp/aniwotawiki/pages/54943.html",
        "https://anime-cinderellagray.com/character/?type=0&i=13",
        "https://wikiwiki.jp/vip_umamusu/元馬情報",
        "https://anime-cinderellagray.com/story/?ep=20",
        "https://anime-cinderellagray.com/character/?type=2&i=6",
        "https://moegirl.icu/黑色艾尔"
      ],
      "clueIds": [
        "dicta-striker-cinderella-original",
        "dicta-striker-cinderella-hakodate-record",
        "dicta-striker-cinderella-bullet-shot-zone",
        "dicta-striker-cinderella-trainer-kouchi",
        "dicta-striker-cinderella-classroom-black-ale"
      ]
    },
    {
      "characterId": "gold-city",
      "kind": "main",
      "nameJa": "ゴールドシチー",
      "sources": [
        "https://umamusu.wiki/Gold_City",
        "https://anime-cinderellagray.com/character/?type=0&i=14",
        "https://gorilife.com/umamusume-11/3/",
        "https://wikiwiki.jp/vip_umamusu/元馬情報"
      ],
      "clueIds": [
        "gold-city-cinderella-original",
        "gold-city-cinderella-shampoo-question",
        "gold-city-cinderella-opening-derby-runner"
      ]
    },
    {
      "characterId": "symboli-rudolf",
      "kind": "main",
      "nameJa": "シンボリルドルフ",
      "sources": [
        "https://umamusu.wiki/Symboli_Rudolf",
        "https://anime-cinderellagray.com/story/?ep=5",
        "https://anime-cinderellagray.com/character/?type=0&i=15",
        "https://anime-cinderellagray.com/story/?ep=9",
        "https://anime-cinderellagray.com/character/?type=0&i=16"
      ],
      "clueIds": [
        "symboli-rudolf-cinderella-original",
        "symboli-rudolf-cinderella-derby-petition",
        "symboli-rudolf-cinderella-maruzensky-adviser"
      ]
    },
    {
      "characterId": "maruzensky",
      "kind": "main",
      "nameJa": "マルゼンスキー",
      "sources": [
        "https://umamusu.wiki/Maruzensky",
        "https://anime-cinderellagray.com/story/?ep=9",
        "https://anime-cinderellagray.com/character/?type=0&i=16",